{
  "atom_version": "0.1.0",
  "atom_id": "A1",
  "atom_name": "Schema-Bound Extraction",
  "primary_mechanism": "OutputContract",
  "supporting_mechanisms": [
    "EvidenceBundle",
    "ValidatorGate"
  ],
  "capability_under_test": "Extract required fields from noisy planning notes into the exact requested JSON shape.",
  "non_goals": [
    "Do not evaluate general prose quality.",
    "Do not evaluate broad end-to-end workflow success."
  ],
  "input_contract": {
    "required_inputs": [
      "input.md",
      "task_spec.json",
      "output_contract.json"
    ],
    "fixed_snapshot": true,
    "forbidden_assumptions": [
      "Do not use live web state.",
      "Do not assume files, evidence, or constraints absent from the fixture."
    ]
  },
  "output_contract_id": "out_mechanism_a1_schema_bound_extraction_001",
  "pass_criteria": [
    {
      "metric": "schema_validity",
      "threshold": 1.0,
      "required": true
    },
    {
      "metric": "task_success",
      "threshold": 0.8,
      "required": true
    }
  ],
  "known_failure_modes": [
    "Missing required structure"
  ],
  "composition_interface": {
    "input_from_previous": [
      "fixed_snapshot"
    ],
    "output_to_next": [
      "structured_state"
    ],
    "state_dependencies": [],
    "evidence_dependencies": [
      "evidence_bundle"
    ],
    "failure_signal": "schema-bound-extraction_failed",
    "repair_policy": "stop_and_report"
  }
}
